Category,Caetgory Description,Name,ImageURL,Date of Appointment,La,Lo,Workplace,Notes,DegreeMuseum Director,,Mary Levkoff,,2014,35.685208,-121.168225,Hearst Castle,Director,"MA, 1978"Curatorial,,"Denise Lynn Birkhofer, PhD",,2014,41.293594,-82.216549,The Allen Memorial Art Museum,Curator of Modern and Contemporary Art,"PhD, 2013"Conservation,,Serena Urry,,2012,39.114285,-84.497291,Cincinnati Art Museum,"Chief Conservatro, Cincinnati Art Museum.","Certificate in Conservation, 1989"Education,,Joseph S. Ackley,,2014,40.808059,-73.964008,Columbia University,Mellon Postdoctoral Teaching Fellow in the Department of Art History and Archaeology.,"PhD, 2014"Education,,Jennifer Babcock,,2014,40.779928,-73.960263,"Institute for the Study of the Ancient World, NYU",Curatorial Postdoctoral Associate.,"PhD, 2014"Curatorial,,"Esther Bell, PhD",,2014,37.784466,-122.500842,Fine Arts Museums of San Francisco,"Curator in Charge, European Paintings","PhD, 2011"Curatorial,,"Michael Brown, PhD",,2014,32.731837,-117.149591,San Diego Museum of Art,Associate Curator of European Art,"PhD, 2011"Education,,"Miriam Basili, oPhD",,2014,40.729768,-73.994921,NYU,Associate Professor of Art History and Museum Studies,"PhD, 2002"Non-profit Arts Administration,,Kellie Morgan,,2014,40.000684,-83.009392,Wexner Center for the Arts,Community Outreach and Marketing Manager for the Wexner Center for the Arts.,"MA, 2010"For-profit Arts Professional,,Mark Loiacano,,2014,40.719005,-73.987354,Lisa Cooley Gallery,Director,"MA, 2005""Editors, Writers or Publishers",,Julianna White,,2014,41.308333,-72.930451,Yale University Art Gallery,"Editorial Assistant, Publications and Editorial Services at Yale University Art Gallery.","MA, 2013"Public Relations and Marketing,,Caroline Boillod,,,40.762175,-73.972862,Brevan Howard US LLC,Marketer,"MA, 2002""Editors, Writers Or Publishers",,Dr. Ariella G. Budick,,,40.746334,-73.982464,Newsday,Art critic,"PhD, 1996"Other Occupations,,Rachel G. Wilf,,,40.760007,-73.968501,Gurr Johns,Account Manager,MAOther Occupations,,Arlene C. Wise,,,40.761697,-73.980126,Chadbourne & Parke, ,"XX, 1981"Public Relations And Marketing,,Shellie Winkler,,2013,40.728535,-74.007383,MSLGROUP North America,"Chief Strategy Officer, MSLGROUP North America","MA, 1984"Education,,Sheila Dillon,,2014,41.919769,-91.649501,Duke University,"Chairperson, Department of Art","PhD, 1994"Education,,Ana M. Franco,,2014,4.601586,-74.065274,Universidad de los Andes,Assistant Professor,"PhD, 2012"Curatorial,,Aimee E Froom,,2014,29.72568,-95.390482,"Museum of Fine Arts, Houston.",Curator of Islamic art,"PhD, 2001"Curatorial,,Kathryn Gunsch,,2014,39.325918,-76.61917,Baltimore Museum of Art,Teel Curator of African and Oceanic Art.,"PhD, 2012"Education,,Maile Hutterer,,2014,44.04483,-123.072606,University of Oregon,Assistant Professor,"PhD, 2011"Education,,Sarah Madole,,2014,40.76874,-73.95978,Marymount Manhattan College,Adjunct Professor,"PhD, 2012"Non-profit Arts Administration,,Erika Nelsen,,2014,47.607262,-122.338144,Seattle Art Museum,Grants Manager for the Seattle Art Museum.,"MA, 2012"Education,,Adele Nelson,,2014,39.983461,-75.153377,Tyler School of Art,Professsor of Art History,"PhD, 2012"Curatorial,,Lelia Packer,,2014,51.508929,-0.128299,The National Gallery in London,McCrindle Curatorial Assistant,"PhD, 2012"Curatorial,,"Tricia Paik, Ph.D",,2014,39.825502,-86.185097,Indianapolis Museum of Art,Curator of Contemporary Art,"PhD, 2009"Non-profit Arts Administration,,Karin Ann Sanders,,2014,40.7465,-74.001374,Paul Ickovic Foundation,Collection Director,"MA, 2013"Museum Director,,Stephanie Stebich,,,47.247498,-122.437037,Tacoma Art Museum,Director,"MA, 1998"Museum Director,,Angus Trumble,,2014,-35.299383,149.131527,"National Portrait Gallery, Australia",Director,"MA, 1998"Curatorial,,Jeffrey Uslip,,2014,38.64061,-90.234879,Contemporary Art Museum St. Louis.,Chief curator.,PhD CandidateCuratorial,,Andaleeb Badiee Banta,,2013,41.293594,-82.216549,The Allen Memorial Art Museum,"Curator, European & American Art.","PhD, 2007"Museum Director,,Caroline Baumann,,2013,40.784453,-73.957974,Cooper-Hewitt Museum,Director,"MA, 1990"Education,,Laurel Diane Bestock,laurel_bestock.png,2013,41.826772,-71.402548,Brown University,Vartan Gregorian Assistant Professor.,"PhD, 2007"Non-profit Arts Administration,,Tia Chapman,,2013,40.771277,-73.967134,The Frick Collection,Deputy Director for External Affairs,"MA, 1993"Education,,Maura Coughlin,,2013,41.921068,-71.53827,Bryant University,Associate Professor of Visual Studies.,"PhD, 2001"Non-profit Arts Administration,,Jason Dubs,,2013,40.761433,-73.977622,Museum of Modern Art,Museum Research Consortium Project Manager,"PhD, 2012"Curatorial,,Sarah Humphreville,,2013,40.739366,-74.00891,Whitney Museum of American Art,Curatorial Assistant,"MA, 2013"Education,,Lauren Jacobi,,2013,42.360091,-71.09416,Massachusetts Institute of Technology.,"Assistant Professor, Department of Architecture.","PhD, 2012"Education,,Abby Kornfeld,,2013,40.807536,-73.962573,City College of New York,Assistant Professor of Art History,"PhD, 2013"Education,,Areli Marina,,2013,40.101952,-88.227161,University of Illinois at Urbana-Champaign,Received tenure,"PhD, 2004"Non-profit Arts Administration,,Nick Marmor,,2013,42.360091,-71.09416,Massachusetts Institute of Technology,"Development Associate, Foundation Relations Office.","MA, 2013"Education,,Kathryn Blair Moore,,2013,22.282999,114.137085,University of Hong Kong,Assistant Professor of Art History,"PhD, 2011"Curatorial,,Merribell M. Parsons,,2013,29.437331,-98.482137,San Antonio Museum of Art.,Curator of European Art,"MA, 1967"Curatorial,,"Marika Sardar, PhD",,2013,32.731837,-117.149591,San Diego Museum of Art,"Associate Curator, Southern Asian and Islamic Art.","PhD, 2007"Non-profit Arts Administration,,Sarah Schroth,,2013,41.919769,-91.649501,Duke University,,"PhD, 1990"Conservation,,Serena Urry,,2012,39.114285,-84.497291,Cincinnati Art Museum,"Chief Conservatro, Cincinnati Art Museum.","Certificate in Conservation, 1989"Education,,Mark B. Abbe,,,32.940468,-84.369506,"University of Georgia, Lamar Dodd School of Art",Assistant Professor of Ancient Art,"Certificate in Conservation, 1989, PhD, 2013"Education,,James S. Ackerman,,,42.377003,-71.11666,Harvard University,"Professor Emeritus, Department of the History of Art and Architecture","MA, 1947"Education,,Ellen Adams,,,39.510533,-84.730877,Miami University,Assistant Professor,"PhD, 2007"Education,,Nicholas Adams,,,41.686662,-73.894944,Vassar College,Professor of Art on the Mary Conover Mellon Chair,"MA, 1973"Education,,Zainab al Bahrani,,,40.807536,-73.962573,Columbia University,Edith Porada Professor of Art History & Archaeology,"PhD, 1989"Education,,Joseph D. Alchermes,,,41.378688,-72.104587,Connecticut College,Associate Professor,"MA, 1985"Conservation,,Samantha Alderson,,,40.781324,-73.973988,American Museum of Natural History,"Associate Conservator of Objects, Anthropology Department","Certificate in Conservation, 1994"Curatorial,,Denise M. Allen,,,40.779187,-73.963535,deschamps,"Curator, European Sculpture/Decorative Arts","MA, 1988"Education,,Marta Elena Ameri,,,34.804553,-87.67935,Coby College,,"PhD, 2010"Curatorial,,Lynne D. Ambrosini,,,39.102143,-84.502583,Taft Museum of Art,Chief Curator,"PhD, 1989"Museum Director,,Patrick Amsellem,,,55.707819,13.198439,Skissernas Museum of Public Art,Director,"PhD, 2007"Education,,Michael J. Amy,,,43.083203,-77.675612,Rochester Institute of Technology,Associate Professor of Art History,"PhD, 1997"Education,,Lilli Lonngren Anders,,,40.614594,-74.090871,Wagner College of Staten Island,Professor,"PhD, 1997"Education,,Martha G. Anderson,,,42.253424,-77.787959,Alfred University,Professor of Art History,Non-profit Arts Administration,,Katherine Anne Andrews,,,39.960642,-75.172137,The Barnes Foundation,Corporate Programs Manager,"MA, 2007"Education,,Lynn A. Angelo,,,38.547271,-121.745242,Davis Joint Unified School District,Teacher,"PhD, 1993"Conservation,,Barbara A. Appelbaum,,,40.797016,-73.9612,Appelbaum & Himmelstein,Partner/Conservator,"Certificate in Conservation, 1973"Curatorial,,Afsaneh Ardalan,,,42.37414,-71.114187,Arthur M. Sackler Museum,"Research Assistant, Islamic Department","MA, 1990"Education,,Kathleen Giles Arthur,,,38.435092,-78.869755,James Madison University,"Prof Emeritus of Art History, School of Visual & Performing Arts",Conservation,,Nancy E. Ash,,,39.96557,-75.180966,Philadelphia Museum of Art,Senior Conservator of Works of Art on Paper,"Certificate in Conservation, 1978"Non-profit Arts Administration,,Victoria Adoracion Azurin,,,40.781324,-73.973988,American Museum of Natural History,Membership Associate,"MA, 2014"Non-profit Arts Administration,,Sussan Babaie,babaie.png,,30.033901,31.213813,Binational Fulbright Commission in Egypt,Fulbright Regional Scholar,"PhD, 1994"Non-profit Arts Administration,,Sherine Badawi Walton,,,34.022352,-118.285117,University of Southern California,"Deputy Director, USC Center on Public Diplomacy","MA, 1998"Curatorial,,Rhonda M. Baer,,,42.339381,-71.094048,"Museum of Fine Arts, Boston",Senior Curator of European Paintings,"PhD, 1990"Other Occupations,,Angela Tau Bailey,,,30.332234,-81.655672,Bailey Family Holdings LLC,,"MA, 1988"Conservation,,Sanchita Balachandran,,,39.329901,-76.620518,Johns Hopkins University ,"Curator/Conservator, Archaeology Museum","Certificate in Conservation, 2003"Curatorial,,Sanchita Balachandran,,,40.329901,-75.620518,Johns Hopkins University ,"Curator/Conservator, Archaeology Museum","Certificate in Conservation, 2003"Conservation,,Ann M. Baldwin,,,41.026242,-73.628196,Greenwich Studios,Paper Conservator,"Certificate in Conservation, 1998"Education,,Jennifer L. Ball,,,40.630942,-73.950582,"Brooklyn College, CUNY","Associate Professor, Art Department","PhD, 2001"Conservation,,Mary W. Ballard,,,38.888786,-77.026023,Smithsonian Institution,"Senior Textile Conservator, Center for Materials Research & Education","Certificate in Conservation, 1979"Conservation,,Sarah Barack,,,40.776338,-73.964047,Institute of Fine Arts,Adjunct Faculty ,"Certificate in Conservation, 2003"Other Occupations,,Birjees Barakat,,,40.763668,-73.974802,Kohlberg Kravis Roberts & Co.,Executive Assistant to John Saer,"PhD, 1984"Education,,Mary Lee Baranger,,,41.021205,-73.709653,Manhattanville College,Professor Emerita,"PhD, 1960"Conservation,,Daphne S. Barbour,,,38.891298,-77.019965,National Gallery of Art,Senior Objects Conservator,"Certificate in Conservation, 1988"Education,,William Lee Barcham,,,40.746901,-73.994081,Fashion Institute of Technology,Professor,"PhD, 1983"Education,,Julianna Maria Bark,,,46.257938,6.150186,"Webster University, Switzerland",,"PhD, 2009"Museum Director,,Elizabeth Ellen Barker,,,42.3579,-71.062088,Bost`on Athenaeum,Stanford Calderwood Director,"PhD, 2003"Non-profit Arts Administration,,Susan Johnston Barnes,,,40.696389,-73.849444,St. Matthew's Episcopal Church,Senior Associate Rector,"PhD, 1986"For-profit Arts Professional,,Robert A. Baron,,,,,,Photographer,"MA, 1968"Education,,Beryl Barr-Sharrar,,,40.776338,-73.964047,Institute of Fine Arts,Adjunct Professor/Art Historian,"PhD, 1980"Conservation,,Julie K. Barten,,,40.78298,-73.958971,Solomon R. Guggenheim Museum,Senior Conservator,"Certificate in Conservation, 1993"For-profit Arts Professional,,Dorothea L. Basile,,,40.678746,-73.999211,ARTime,Director,"MA, 1988"Education,,Miriam Basilio,,,40.729513,-73.996461,New York University,Assistant Professor/Faculty Fellow,"PhD, 2002"Education,,Linda Freeman Bauer,,,33.640495,-117.844296,"University of California, Irvine",Professor,Conservation,,Kenneth Be,,,41.246108,-95.960385,Gerald R. Ford Conservation Center,Head of Paintings Conservation,"Certificate in Conservation, 1987"Education,,Madeleine Fidell Beaufort,,,48.859323,2.303893,American University of Paris,"Professor, Art History Department","MA, 1968"Conservation,,Deborah Bede,,,43.266804,-71.934085,"Stillwater Textile Conservation Studio, LLC",,"Certificate in Conservation, 1982"Curatorial,,"Daniel M. Belasco, PhD",,,41.741106,-74.083439,Samuel Dorsky Museum of Art,Curator of Exhibitions and Programs,"PhD, 2008"Non-profit Arts Administration,,Katherine Krupp Benardo,,,40.761433,-73.977622,Museum of Modern Art,Product Developer,"MA, 1991"Conservation,, Wendy A. Bennett,,,40.444457,-79.918172,Wendy Bennett Fine Art Paper Conservation,,"Certificate in Conservation, 1985"Curatorial,,Brian William Bentley,,,40.671206,-73.963631,Brooklyn Museum,Curatorial Assistant,"MA, 2013"Education,,Michelle Lita Berenfeld,,,34.104669,-117.704739,Pitzer College,"Assistant Professor, Department of Classics","PhD, 2002"Education,,Patricia G. Berman,,,42.293573,-71.305928,Wellesley College,Professor of Art History,"PhD, 1989"Education,,Jo Anne G. Bernstein,,,37.780054,-122.183162,Mills College,Professor of Art History,Education,,Aimee Bessire,,,43.655638,-70.260822,Maine College of Art,Assistant Professor of Art History,"MA, 1991"Education,,William E. Betsch,,,25.721637,-80.279284,University of Miami,"Professor, Department of Art & Art History","PhD, 1967"Curatorial,,Carol Manson Bier,,,38.91391,-77.051092,The Textile Museum,Research Associate,Education,,Emily Ida Bills,,,34.213625,-118.348821,Woodbury University,Adjunct Faculty ,"PhD, 2006"Non-profit Arts Administration,,Emily Ida Bills,,,34.213625,-118.348821,Woodbury University,Director of the Woodbury School of Architecture,"PhD, 2006"Education,,Heather L. Birdsall,,,,,McElroy Tutoring,Tutor,"MA, 2011"Education,,Ellen R. Birnbaum,,,40.783062,-73.95268,92nd Street Y Nursery School,Associate Director,"MA , 1991"Curatorial,,Jennifer M. Blessing,,,40.78298,-73.958971,Solomon R. Guggenheim Museum,Project Curator,"MA, 1990"Museum Director,,Arthur R. Blumenthal,,,28.592173,-81.346215,Cornell Fine Arts Museum,Director Emeritus,"PhD, 1984"Conservation,,Gwendolyn Boeve-Jones,,,52.112358,4.359206,Redivivus BV,Director,"Certificate in Conservation, 1994"Other Occupations,,,,,,,,,Public Relations and Marketing,,,,,,,,,"Editors, Writers or Publishers",,,,,,,,,Education,,"Carol Radcliffe Bolon, PhD",,,,,Fairfax County Public Schools,High School Teacher,"PhD, 1981"For-profit Arts Professional,,Virginia Anne Bonito,,,40.860903,-73.854685,The Mnemosyne Foundation,Founder and CEO,"MA, 1983"Education,,Sonya Gale Bonneau,,,38.907609,-77.072258,Georgetown University Law Center,"Associate Professor, Legal Research and Writing","MA, 1992"For-profit Arts Professional,,Kathryn W. Bonomi,,,41.135149,-73.791739,Jacob Burns Film Center,Independent Film Programmer,"MA, 1988"Curatorial,,Suzanne R. Boorsch,,,41.308724,-72.930716,Yale University Art Gallery,"Curator, Prints, Drawings, and Photographs","MA, 1975"Education,,Eve Borsook,,,43.786878,11.309931,Villa I Tatti | The Harvard University Center for Italian Renaissance Studies,Research Associate,Curatorial,,Edgar P. Bowron,,,29.725069,-95.389499,"The Museum of Fine Arts, Houston",Curator of European Art,"MA, 1969"Curatorial,,Dr. Laurel E. Bradley,,,45.387384,-75.698039,Carleton College Art Gallery,Director of Exhibitions and Curator,"PhD, 1996"Non-profit Arts Administration,,Dr. Laurel E. Bradley,,,45.387394,-75.698039,Carleton College Art Gallery,Director of Exhibitions and Curator,"PhD, 1996"Curatorial,,Ms. Jeanne Brako,,,37.275339,-107.868411,"Fort Lewis College, Center for Southwest Studies",Curator of Collections & Public Programs,"Certificate in Conservation, 2002"Education,,"Mary K. Brantl, PhD",,,30.230279,-97.75489,St. Edward's University,Art Historian,"PhD, 1998"Non-profit Arts Administration,,Louise Tharaud Brasher,,,33.521755,-86.810297,Birmingham Museum of Art,Assistant Curator of Education/Coordinator for Disabilities,"MA, 1981"Education,,Dr. Emily Braun,,,40.768,-73.964317,Hunter College CUNY,"Professor, Art History Department","PhD, 1991"Non-profit Arts Administration,,Ms. Catherine Coleman Brawer,,,40.770082,-73.960891,Ida & William Rosenthal Foundation,President,"MA, 1966"Curatorial,,Katherine Mary Brinson,,,40.78298,-73.958971,Solomon R. Guggenheim Museum,"Curator, Contemporary Art","MA, 2005"Non-profit Arts Administration,,Marcia E. Brocklebank,,,38.81925,-77.047467,Art Services International,U.K. Representative,"MA, 1963"Education,,Joyce G. Brodsky,,,36.991386,-122.060872,"University of California, Santa Cruz","Prof, Department of Art","MA, 1958"Curatorial,,"Lisa R. Brody, PhD",,,41.308724,-72.930716,Yale University Art Gallery,Associate Curator of Ancient Art,"PhD, 1999"Education,,"Sarah Tyler Brooks, PhD",,,38.435092,-78.869755,James Madison University,"Assistant Professor, School of Art and Art History","PhD, 2002"Conservation,,Lynn B. Brostoff,,,38.888684,-77.004719,Library of Congress,"Research Chemist, Preservation Research and Testing Division","Certificate in Conservation, 1987"For-profit Arts Professional,,Michelle Ilana Brown,,,40.756856,-73.972292,Sotheby's,,"MA, 2012"Conservation,,Karl D. Buchberg,,,40.761433,-73.977622,Museum of Modern Art,Senior Conservator,"Certificate in Conservation, 1984"For-profit Arts Professional,,"Robert T. Buck, Jr.",,,40.763696,-73.976461,Marlborough Gallery,Director,"MA, 1965"Curatorial,,"Rosina Buckland, PhD",,,55.946971,-3.190862,National Museum of Scotland,"Senior Curator, East and Central Asia","PhD, 2008"Conservation,,Friederike C. Buehler-Steckling,,,47.588102,7.651016,Fondation Beyeler,Conservator,"Certificate in Conservation, 1998"Curatorial,,Emma Cadwalader Bunker,,,39.737188,-104.989345,Denver Art Museum,Research Consultant,"MA, 1962"For-profit Arts Professional,,Jennifer G. Buonocore,,,,,LMN Arts,Gallery Assistant,"MA, 2012"Curatorial,,Dr. Marcus B. Burke,,,40.833456,-73.94687,The Hispanic Society of America,"Curator, Ptgs., Drawings & Metalwork","PhD, 1984"Education,,"Olga Bush, PhD",,,41.686662,-73.894944,Vassar College,Adjunct Assistant Professor in Art,"PhD, 2006"For-profit Arts Professional,,Dr. Andrew W. Butterfield,,,40.712784,-74.005941,"Andrew Butterfield Fine Arts, LLC", ,"PhD, 2002"Education,,Dr. Walter B. Cahn,,,41.316324,-72.922343,Yale Unversity,Professor Emeritus,"MA, 1961"Curatorial,,Dr. Marietta Cambareri,,,42.339381,-71.094048,"Museum of Fine Arts, Boston","Curator, Decorative Arts and Sculpture and Jetskalina H. Phillips Curator of Judaica","PhD, 2006"Museum Director,,Mr. Patrick Cardon,,,44.019249,-69.239769,"The Museum in the Streets, LLC",Director,"MA, 1976"Education,,Mr. Erik L. Carlson,,,37.37581,-122.213107,Woodside Priory School,Dean of Students,"MA, 1994"Curatorial,,Ms. Kate Carmel,,,40.77317,-73.981506,American Craft Museum,Chief Curator,"MA, 1963"Curatorial,,Dr. Dawson W. Carr,,,45.516879,-122.683231,Portland Art Museum,Janet and Richard Geary Curator of European Art,"PhD, 1987"Conservation,,Ms. Ellen Carrlee,,,58.300193,-134.415805,Alaska State Museum,Conservator,"Certificate in Conservation, 2000"For-profit Arts Professional,,Mr. Edward Peter Catto,,,,,Ward & Company Works of Art, ,"MA, 2002"For-profit Arts Professional,,Mr. Francis M. Celentano,,,,, ,Painter,"MA, 1957"Education,,Dr. Claude Cernuschi,,,42.335549,-71.168495,Boston College,"Chairperson, Art History","PhD, 1988"Curatorial,,Cathleen Chaffee,,,42.93245,-78.875618,Albright-Knox Gallery,Senior Curator,"PhD, 2013"Education,,Ms. Veronique Chagnon-Burke,,,40.754247,-73.981944,Christie's Education,Director of Studies/Associate Professor,"MA, 1990""Editors, Writers Or Publishers",,Ms. Anne Palms Chalmers,,,,,Houghton Mifflin Company,"Art Director, Cookbooks & Guidebooks","MA, 1969"Conservation,,Mr. Peter S. Champe,,,40.703784,-74.008047,"Robert Silman Associates, P.C. Consulting Engineers",Architectural Conservator,Certificate in ConservationNon-profit Arts Administration,,Ms. Nancy Maria Chang,,,22.293524,114.172145,Hong Kong Museum of Art,"Chairman, The Friends of the Hong Kong Museum of Art","MA, 1989"Conservation,,Ms. Esther Hui-Hui Chao,,,42.377003,-71.11666,Harvard University,Assistant Conservator,"Certificate in Conservation, 1981"Curatorial,,"Mary Weaver Chapin, PhD",,,45.516879,-122.683231,The Portland Art Museum,Curator of Prints and Drawings,"PhD, 2002"Conservation,,Ellen Chase,,,38.887908,-77.026494,Freer & Sackler Galleries,Objects Conservator,"Certificate in Conservation, 1993"Education,,Ms. Michele Kelly Chase,,,40.79483,-74.195429,Bloomfield College,Assistant Professor of History,"MA, 2005"Conservation,,"Mr. William T. Chase, III",,,,,Chase Art Services, ,"Certificate in Conservation, 1967"Curatorial,,"Sheldon L. Cheek, PhD",,,42.372735,-71.12108,The Hutchins Center for African and African American Research,"Senior Curatorial Associate, Image of the Black Archive & Library","PhD, 2000"Conservation,,Ms. Andrea Y. Chevalier,,,41.48949,-81.711361,Intermuseum Conservation Association,Senior Paintings Conservator,"Certificate in Conservation, 1988"Curatorial,,"Jennifer Y. Chi, PhD",,,40.779928,-73.960263,"Institute for the Study of the Ancient World, NYU",Exhibitions Director and Chief Curator,"PhD, 2002",,Ms. Ling-Yi Chien,,,,,"Art, Culture, and Business Development",Consultancies,"MA, 2005"Non-profit Arts Administration,,Ms. Elizabeth Childs-Johnson,,,32.830954,-83.652934,US State Department,Senior Cultural Property Consultant,"PhD, 1984"Conservation,,Ms. Perry Chisoo Choe,,,55.941008,-3.179668,Royal Commission on Ancient and Historic Monuments,Project Conservator,"Certificate in Conservation, 1999"Museum Director,,"Alan D. Chong, PhD",,,1.287408,103.851722,Asian Civilisations Museum (ACM),Director,"PhD, 1992"Conservation,,Ms. Sue Ann Chui,,,34.078808,-118.475026,The J. Paul Getty Museum,Assistant Conservator,"Certificate in Conservation, 1999",,"Yeon Shim Chung, PhD",,,,, , ,"PhD, 2005"Non-profit Arts Administration,,Ms. J. Mikel Clifford,,,46.729553,-94.6859,Minnesota Shakespeare Company,Artistic Director,"MA, 1966"For-profit Arts Professional,,Mr. Brian Michael Coburn,,,27.041035,114.909267,A & E Television Networks,Human Resources,"MA, 2009",,Ms. Cheri L. Coffin,,,,,Thornton-Donovan School,Middle/High School Teacher of Social Science,"MA, 1994",,Dr. Beth Cohen,,,,, ,Self-Employed,"MA, 1970"Museum Director,,Ms. Janie L. Cohen,,,44.479898,-73.197024,Robert Hull Fleming Museum,Director,"MA, 1986"Education,,Dr. Marilyn A. Cohen,,,,,Cooper-Hewitt/Bard G.C.,Adjunct Faculty,"PhD, 1987"Other Occupations,,Dr. Ronny H. Cohen,,,,,Halstead Property,Sales Associate,"MA, 1974"Curatorial,,Ms. Sari Neidell Cohen,,,,,Neuberger Berman,Collection Manager/AVP,"MA, 1998"Education,,"Judith Colton, PhD",,,,,Yale University,Professor Emeritus,"MPhD, 1974"Education,,Dr. Carolyn Loessel Connor,,,35.904912,-79.046913,University of North Carolina at Chapel Hill,Professor of Classics,"PhD, 1987"Non-profit Arts Administration,,Ms. Elizabeth Anne Coup,,,39.044968,-94.580923,Nelson-Atkins Museum,Department Assistant,"MA, 2009"Curatorial,,Ms. Alexandra Courcoulas,,,45.491064,-73.578631,Canadian Centre for Architecture,Curatorial Intern,"MA, 2012"Education,,Professor Nicola M. Courtright,,,42.37091,-72.517003,Amherst College,"William R. Kenan, Jr. Professor of the History of Art; Chair of European Studies","PhD, 1990",,Dr. Dario A. Covi,,,,,Part-Time Curator of Art Collection,Professor Emeritus,"PhD, 1958"Non-profit Arts Administration,,Ms. Ann B. Craddock,,,40.746923,-73.940904,The Sculpture Center,Executive Director,"Certificate in Conservation, 1991"Education,,Mr. Stephen Paul Crenshaw,,,41.843885,-71.434668,Providence College,Associate Professor,"PhD, 2000"Curatorial,,Ms. Ivy Crewdson,,,40.749019,-74.004646,Barbara Gladstone Gallery,Curator,"BA, 1997"For-profit Arts Professional,,Ms. Wendy M. Cromwell,,,,,"Cromwell Art, LLC",Art Advisor,"MA, 1990"Conservation,,Ms. Dena Crosson,,,38.961569,-76.94097,Crosson Fine Art ,Owner/Accredited,"MA, 1986"Non-profit Arts Administration,,Ms. Eszter Gabriella Csicsai,,,40.749687,-73.974661,American Council of Learned Societies,"Program Associate, African Humanities Program ","MA, 2009",,Dr. Slobodan Curcic,,,,, , ,,,Professor Kathleen A. Curran,,,,,Trinity College,Associate Professor,,,Ms. Elizabeth Mize Currie,,,,,Currie Capital LLC,Manager,"MA, 1980"Other Occupations,,Ms. Michelle-Louise C. Da Re,,,,,Law Offices of DaRe & Gough,Owner/Attorney,"MA, 1993"Conservation,,Ms. Kristi Anne Dahm,,,41.879584,-87.623713,Art Institute of Chicago,Assistant Conservator of Prints & Drawing,Certificate in ConservationCuratorial,,Ms. Maria F. P. Saffiotti Dale,,,43.073836,-89.398635,"University of Wisconsin-Madison, Chazen Museum of Art","Curator of Paintings, Sculpture, & Decorative Arts",Certificate in Curatorial StudiesConservation,,Ms. Rachel L. Danzing,,,40.671206,-73.963631,Brooklyn Museum,Associate Paper Conservator,Certificate in ConservationEducation,,Professor Benjamin David,,,45.452202,-122.677485,Lewis & Clark College,Associate Professor of Art History,PhDConservation,,Ms. Suzanne L. Davis,,,42.276714,-83.741381,Kelsey Museum of Archaeology,Curator (Head) of Conservation,Certificate in ConservationFor-profit Arts Professional,,Ms. Lacy Davisson-Doyle,,,40.774727,-73.980979,"Artview NYC, LLC",Founder,"MA '81, IFA (GSAS/Fine Arts)"Education,,Dr. Kim T. de Beaumont,,,40.768,-73.964317,Hunter College CUNY,Adjunct Professor,PhD,,Ms. Emily M. Dellheim,,,,, ,NYU Graduate Student,"BA '08, Gallatin (Individualized Major); MA '14, IFA (GSAS/History of Art and Archaeology)"Education,,Dr. Don W. Denny,,,38.986918,-76.942554,University of Maryland,Professor Emeritus,"MA '61, IFA (GSAS/Fine Arts)"Education,,Dr. Margaret Denton,denton_margaret.png,,37.573961,-77.539614,University of Richmond,Associate Professor,"PhD, 1986"Museum Director,,"Andria Derstine, PhD",,,41.293594,-82.216549,The Allen Memorial Art Museum,Director,PhDCuratorial,,Dr. Isabelle M. Dervaux,,,40.749375,-73.981344,The Morgan Library & Museum,Curator of Modern & Contemporary Drawings,PhD