Author,Title,Degree,Year,Advisor,Advisor2,Category,Category2,,IFA categories (just for reference)
"PIOTROWSKA, Anna Karolina",The early career of Carle Vanloo: Training and practice in the capitals of Europe,Ph.D.,2009,"Westermann, Mariët","Bailey, Colin",Seventeenth- and Eighteenth-Century Art,,,
"WILDE, Deborah N.",Housing and urban development in sixteenth century Rome : the properties of the Arciconfraternita della SSma Annunziata,Ph.D.,1989,"Krautheimer, Richard","Brandt, Kathleen Weil-Garris",Seventeenth- and Eighteenth-Century Art,,,
"WOLF, Reva",Francisco Goya and the Interest in British Art and Aesthetics in Late Eighteenth-century Spain,Ph.D.,1987,"Rosenblum, Robert","Jonathan, Brown",Seventeenth- and Eighteenth-Century Art,,,
"COWEN, Jill S.",The Istanbul University Library Kalila wa Dimna: an Il-Khanid Masterpiece,Ph.D.,1980,"Grabar, Oleg","Chelkowski, Peter",Art of the Middle East and South Asia,,,
"MYERS, Bernard",St. George and the Dragon,Ph.D.,1933,"McMahon, A. Philip","Cook, Walter W.S.","Early Christian, Byzantine, and Western Medieval Art",Renaissance Art,,
"POTTER, Berit Nicole","Grace McCann Morley and the Dialectical Exchange of Modern Art in the Americas, 1935 – 1958",Ph.D.,2015,"Crow, Thomas","Sullivan, Edward J.",,,,
"UDOVITCH, Joan Diamond",The Papeleu Master: a Parisian Manuscript Illuminator of the Early Fourteenth Century,Ph.D.,1979,"Deuchler, Florens","Eisler, Colin T.","Early Christian, Byzantine, and Western Medieval Art",,,
"BIANCHI, Robert Steven",The Striding Draped Male Figure of Ptolemaic Egypt,Ph.D.,1976,"von Bothmer, Bernard","Fischer, Henry G.","Ancient Aegean, Egyptian, Greek and Roman Art",,,
"LIPSEY, Roger",Signature and Significance: A Study of the Life and Writings of Ananda K. Coomaraswamy,Ph.D.,1974,"Kramrisch, Stella","Goldwater, Robert",Nineteenth- and Twentieth-Century Art,Art of the Middle East and South Asia,,
"SCHWAB, Katherine A.",The Parthenon Metopes and Greek Vase Painting: A Study of Comparison and Influences,Ph.D.,1988,"von Bothmer, Dietrich","Harrison, Evelyn B.","Ancient Aegean, Egyptian, Greek and Roman Art",,,
"PAPANICOLAOU, Linda Morey",Stained Glass Windows of the Choir of the Cathedral of Tours,Ph.D.,1979,"Bober, Harry","Hayward, Jane","Early Christian, Byzantine, and Western Medieval Art",,,
"LACAZE, Charlotte","The Vie de St. Denis Manuscript: (Paris, Bibliothèque Nationale, Ms. fr. 2090-2092)",Ph.D.,1978,"Deuchler, Florens","Janson, H.W.","Early Christian, Byzantine, and Western Medieval Art",,,
"SENIE, Harriet","Studies in the Development of Urban Sculpture, 1950-1975",Ph.D.,1981,"Hitchcock, Henry Russell","Janson, H.W.",Architecture,Nineteenth- and Twentieth-Century Art,,
"COHEN, Beth",Attic Bilingual Vases and their Painters,Ph.D.,1977,"von Bothmer, Dietrich","Kopcke, Günter H.","Ancient Aegean, Egyptian, Greek and Roman Art",,,
"PINCUS, Debra","The Arco Foscari, the Building of a Triumphal Gateway in Fifteenth-century Venice",Ph.D.,1974,"Janson, H.W.","Krautheimer, Richard",Renaissance Art,,,
"WADDY, Patricia",Palazzo Barbarini: Early Proposals,Ph.D.,1973,"Lavin, Irving","Krautheimer, Richard",Seventeenth- and Eighteenth-Century Art,,,
"FREIBERG, Jack",The Lateran and Clement VIII,Ph.D.,1988,"Trachtenberg, Marvin L.","Lavin, Irving",Architecture,Renaissance Art,,
"SMITH, Katherine","Sign Language: Pop Art, Vernacular Architecture, and the American Landscape",Ph.D.,2003,"Cohen, Jean-Louis","Lubar, Robert S.",Architecture,Nineteenth- and Twentieth-Century Art,,
"BRACKEN, William Worth",Rembrandt as Creative Inventor,Ph.D.,2015,"Eric, Jan Sluiter","Westermann, Mariët",,,,
"BRENNAN, Robert Scott",Painting as a Modern Art: The Era of Giotto,Ph.D.,2016,"Alexander, Nagel",Marvin Trachtenberg,,,,
"EPSTEIN, Johanna",The Impressionist Brush: Perceptions of Seventeenth-Century Dutch Art in France,Ph.D.,2007,"Haverkamp-Begemann, Egbert","Nochlin, Linda",Nineteenth- and Twentieth-Century Art,Seventeenth- and Eighteenth-Century Art,,
"EDWARDS, Jennifer Sudul",The Early works of Niki de Saint Phalle,Ph.D.,2014,"Storr, Robert","Nochlin, Linda",Nineteenth- and Twentieth-Century Art,,,East Asian Art
"BARRETT, Kerry",The artful hand: Pieter Soutman's life and oeuvre,Ph.D.,2009,"Westermann, Mariët","Orenstein, Nadine",Seventeenth- and Eighteenth-Century Art,,,
"HARTT, Frederick",Giulio Romano and the Palazzo del Te,Ph.D.,1950,"Friedländer, Walter","Panofsky, Erwin",Renaissance Art,Architecture,,
"VALIELA, Julia Leonor",Model Women: Female Portrait Busts in Renaissance Italy,Ph.D.,2014,"Beverly, Brown",Patricia Rubin,,,,
"SWINBOURNE, Anna Marie",Marvelous Spectacle: The Role of Ostend's ‘Benediction of the Sea’ in Selected Paintings and Drawings by James Ensor,Ph.D.,2015,"Lubar, Robert S.","Soucek, Priscilla",,,,
"MIKOSCH, Elisabeth","Court Dress and Ceremony in the Age of the Baroque, the Royal/Imperial Wedding of 1719 in Dresden",Ph.D.,1999,"Posner, Donald","Raggio, Olga",Seventeenth- and Eighteenth-Century Art,,,
"WRIGHT, Katharine Josephson","Your Art Here: Print Advertisements and Contemporary Art, 1964 - 1974",Ph.D.,2015,"Crow, Thomas",Robert Slifkin,,,,
"VOGEL, Susan Mullin",Baule Art as the Expression of a World View,Ph.D.,1977,"Goldwater, Robert","Sieber, Roy",African and Oceanic Art,,,
"SCAGLIA, Gustina Elizabeth",Studies in the ''Zibaldone'' of Buonaccorso Ghiberti,Ph.D.,1960,"Krautheimer, Richard","Smyth, Craig Hugh",Renaissance Art,,,
"SOTH, Lauren",The Mature Correggio: Studies in the Iconography and Chronology of the Later Paintings,Ph.D.,1970,"Panofsky, Erwin","Smyth, Craig Hugh",Renaissance Art,,,
"DYE, Joseph M.",The Chronology and Stylistic Development of Seventeenth Century Malwa Painting,Ph.D.,1980,"Kramrisch, Stella","Soper, Alexander",Art of the Middle East and South Asia,,,
"ALEXANDER, David Geoffrey",Dhu L-Fakar,Ph.D.,1984,"Nickle, Helmut","Soucek, Priscilla",Art of the Middle East and South Asia,,,
"AMERI, Marta","Sealing at the Edge of the third Millennium Middle Asian Interaction Spheres: The View from Gilund, Rajasthan, India",Ph.D.,2010,"Pittman, Holly","Soucek, Priscilla",Art of the Middle East and South Asia,,,
"WALTON, Guy E.",The Sculptures of Pierre Puget,Ph.D.,1967,"Friedländer, Walter","Sterling, Charles",Seventeenth- and Eighteenth-Century Art,,,
"SIDLEY, Kelly","Beyond Self-Portraiture: The Fabrication of Andy Warhol, 1960-1968",Ph.D.,2006,"Lubar, Robert S.","Storr, Robert",Nineteenth- and Twentieth-Century Art,,,
"BRODSKY, Estrellita Bograd","Latin American artists in postwar Paris: Jesus Rafael Soto and Julio Le Parc, 1950--1970",Ph.D.,2009,"Lubar, Robert S.","Sullivan, Edward J.",Latin American Art,Nineteenth- and Twentieth-Century Art,,
"KLICH, Lynda","Revolution and Utopia: Estridentisimo and the Visual Arts, 1921-27",Ph.D.,2008,"Lubar, Robert S.","Sullivan, Edward J.",Latin American Art,Nineteenth- and Twentieth-Century Art,,
"GREET, Michele","Painting the Indian Nation: Pictorial Indigenism as a Modernist Strategy in Ecuadorian Art, 1920-1960",Ph.D.,2004,"Lubar, Robert S.","Sullivan, Edward J.",Nineteenth- and Twentieth-Century Art,Latin American Art,,
"INDYCH, Anna","Mexican Muralism without Walls: The Critical Reception of Portable Work by Orozco, Rivera, and Siqueiros in the United States, 1927-1940",Ph.D.,2004,"Lubar, Robert S.","Sullivan, Edward J.",Nineteenth- and Twentieth-Century Art,Latin American Art,,
"KATZEW, Ilona",Ordering the Colony : Casta Painting and the Imaging of Race in Eighteenth Century Mexico,Ph.D.,2000,"Lubar, Robert S.","Sullivan, Edward J.",Seventeenth- and Eighteenth-Century Art,Latin American Art,,
"SEVERINI, Lois",The Architecture of Finance: Wall Street 1825-62,Ph.D.,1981,"Hitchcock, Henry Russell","Trachtenberg, Marvin L.",Architecture,Nineteenth- and Twentieth-Century Art,,
"LAMOUREUX, Richard E.",Alberti's Church of San Sebastiano in Mantua,Ph.D.,1975,"Krautheimer, Richard","Trachtenberg, Marvin L.",Renaissance Art,Architecture,,
"BUCKLAND, Rosina",Traveling Bunjin to Imperial Household Artists: Taki Katei (1880-1901) and Transformation of Literati in Late Nineteenth-Century Japan,Ph.D.,2008,"Hay, Jonathan","Trede, Melanie",East Asian Art,Nineteenth- and Twentieth-Century Art,,
"STAPLEFORD, Richard",The Excavation of the Early Christian Martyr's Complex of Sinforsa near Rome,Ph.D.,1974,"Krautheimer, Richard","von Blanckenhagen, Peter","Early Christian, Byzantine, and Western Medieval Art",,,
"CUTTLER, Charles David","The Temptations of Anthony in Art, From Earliest Times to the First Quarter of the XVI Century",Ph.D.,1952,"Schönberger, Guido","Weinberger, Martin","Early Christian, Byzantine, and Western Medieval Art",Renaissance Art,,
"STINSON, Philip",The Civil Basilica of Aphrodisias in its Local and Wider Settings,Ph.D.,2007,"Ratté, Christopher","Welch, Katherine","Ancient Aegean, Egyptian, Greek and Roman Art",,,
"CHI, Jennifer",Studies in the programmatic statuary of Roman Asia Minor,Ph.D.,2002,"Smith, R. R. R.","Welch, Katherine","Ancient Aegean, Egyptian, Greek and Roman Art",,,
"BRANDON, Claire Rita",Spaces of Art in the Exhibition Age: Italy as a Laboratory for Global Exhibition Paradigms since 1970,Ph.D.,2016,"Alexander, Nagel",,,,,
"HERMAN, Nicholas","Jean Bourdichon (1457-1521): Tradition, Transition, Renewal",Ph.D.,2014,"Alexander, Jonathan J.G.",,"Early Christian, Byzantine, and Western Medieval Art",,,"Ancient Aegean, Egyptian, Greek and Roman Art"
"HANAN, Melanie","Romanesque Casket Reliquaries: Forms, Meanings, and Development",Ph.D.,2013,"Alexander, Jonathan J.G.",,"Early Christian, Byzantine, and Western Medieval Art",,,
"KORNFELD, Abby",Meanings in the Margins: Between Text and Image in the Barcelona Haggadah,Ph.D.,2013,"Alexander, Jonathan J.G.",,"Early Christian, Byzantine, and Western Medieval Art",,,
"MONTI, Elizabeth",Art for an Antipope at the Court of Clement VII (1378-1394),Ph.D.,2013,"Alexander, Jonathan J.G.",,"Early Christian, Byzantine, and Western Medieval Art",,,
"NOGUEIRA, Alison Manges","Portraits of the Visconti and the Sforza: Image and Propaganda in Milan, c. 1300-1500",Ph.D.,2008,"Alexander, Jonathan J.G.",,"Early Christian, Byzantine, and Western Medieval Art",Renaissance Art,,
"RAMIREZ-WEAVER, Eric","Carolingian Innovation and Observation in the Paintings and Star Catalogs of Madrid, Biblioteca Nacional, MS. 3307",Ph.D.,2008,"Alexander, Jonathan J.G.",,"Early Christian, Byzantine, and Western Medieval Art",,,
"CARTWRIGHT, Sarah",The Collectio Antiquitatum of Giovanni Marcanova (Modena Biblioteca Estense Universitaria Ms. alfa. L.5.15 = Lat. 992) and the Quattrocento Antiquarian Sylloge,Ph.D.,2007,"Alexander, Jonathan J.G.",,"Early Christian, Byzantine, and Western Medieval Art",Renaissance Art,,
"HUMPHREY, Lyle","The Illumination of Confraternity and Guild Statues in Venice, ca. 1260-1500: Mariegola Production, Iconography, and Use",Ph.D.,2007,"Alexander, Jonathan J.G.",,"Early Christian, Byzantine, and Western Medieval Art",,,
"RUSSAKOFF, Anna","Imaging the Miraculous: Les Miracles de Notre Dame, Paris, BnF, n.acq.fr 24541",Ph.D.,2006,"Alexander, Jonathan J.G.",,"Early Christian, Byzantine, and Western Medieval Art",,,
"FLORA, Holly","Imaging, Gender, Poverty, and Spirituality in the Trecento: The Meditationes Vitae Christi",Ph.D.,2005,"Alexander, Jonathan J.G.",,"Early Christian, Byzantine, and Western Medieval Art",,,
"LEO, Domenic",Authorial Presence in the Illuminated Machaut Manuscripts,Ph.D.,2005,"Alexander, Jonathan J.G.",,"Early Christian, Byzantine, and Western Medieval Art",,,
"CHOI, Kyung-hee","Illuminating Liturgy and Legend: The Missal of Saint-Denis (London, Victoria and Albert Museum Ms. L 1346-1891) and the Royal Abbey in the Fourtheenth Century",Ph.D.,2004,"Alexander, Jonathan J.G.",,"Early Christian, Byzantine, and Western Medieval Art",,,
"OVERBEY, Karen",The Space of the Holy Body: Relics and Reliquaries in Medieval Ireland,Ph.D.,2003,"Alexander, Jonathan J.G.",,"Early Christian, Byzantine, and Western Medieval Art",,,
"EASTON, Martha",The making of the Huntington Library Legenda Aurea and the meaning of martyrdom,Ph.D.,2001,"Alexander, Jonathan J.G.",,"Early Christian, Byzantine, and Western Medieval Art",,,
"L'ENGLE, Susan","The Illumination of Legal Manuscripts in Bologna, 1250-1350: Production and Iconography",Ph.D.,2000,"Alexander, Jonathan J.G.",,"Early Christian, Byzantine, and Western Medieval Art",,,
"DAVID, Benjamin",Relations of Painting and Writing in Fifteenth-Century Siena,Ph.D.,1999,"Alexander, Jonathan J.G.",,"Early Christian, Byzantine, and Western Medieval Art",Renaissance Art,,
"KOSLIN, Desiree",The Dress of Monastic and Religious Women As Seen in Art From the Early Middle Ages to the Reformation,Ph.D.,1999,"Alexander, Jonathan J.G.",,"Early Christian, Byzantine, and Western Medieval Art",,,
"McILWAIN NISHIMURA, Margot",The Gorleston Psalter : A Study of the Marginal in the VisualCulture of Fourteenth-Century England,Ph.D.,1999,"Alexander, Jonathan J.G.",,"Early Christian, Byzantine, and Western Medieval Art",,,
"GUEST, Gerald","Queens, Kings and Clergy Figures of Authority in the 13c Moralized Bible",Ph.D.,1998,"Alexander, Jonathan J.G.",,"Early Christian, Byzantine, and Western Medieval Art",,,
"INGLIS, Erik",Jean Fouquet as a Painter of National History,Ph.D.,1998,"Alexander, Jonathan J.G.",,"Early Christian, Byzantine, and Western Medieval Art",,,
"VIDAS, Marina","Representation and marriage: art, society and gender relations in Florence from the late fourteenth through the fifteenth century",Ph.D.,1997,"Alexander, Jonathan J.G.",,"Early Christian, Byzantine, and Western Medieval Art",,,
"SMITH, Kathyrn","Canonizing the Apocryphal: London B.L. MS. Egerton 2781 and its Visual, Devotional and Social Contexts",Ph.D.,1996,"Alexander, Jonathan J.G.",,"Early Christian, Byzantine, and Western Medieval Art",,,
"STOTZ, Virginia","Romanesque Sculpture on the Façade of Notre-Dame, Saintes",Ph.D.,1995,"Alexander, Jonathan J.G.",,"Early Christian, Byzantine, and Western Medieval Art",,,
"BOOTON, Diane",Pictorial Seasons: A Cultural Study of the Cycle of Calendar Paintings in the Torre dell'Aquila,Ph.D.,1994,"Alexander, Jonathan J.G.",,"Early Christian, Byzantine, and Western Medieval Art",,,
"SCHULER, Karl Frederick",The Pictorial Program of the Chapterhouse of Sigena,Ph.D.,1994,"Alexander, Jonathan J.G.",,"Early Christian, Byzantine, and Western Medieval Art",,,
"GRIFFIN, Jocelyn Crane",Pointing Gestures in Medieval Miniatures: A Study Based on Illustrated Manuscripts of the Terence Comedies,Ph.D.,1991,"Alexander, Jonathan J.G.",,"Early Christian, Byzantine, and Western Medieval Art",,,
"LaROW, Magdalen",The Iconography of Mary Magdalen: The Evolution of a Western Tradition Until 1300,Ph.D.,1982,"Bober, Harry",,"Early Christian, Byzantine, and Western Medieval Art",,,
"EDMONDSON, Kristine",The Psalter of Henry of Blois: A Study in Romanesque Manuscript Illumination,Ph.D.,1978,"Bober, Harry",,"Early Christian, Byzantine, and Western Medieval Art",,,
"LITTLE, Charles T.",The Magdeburg Ivory Group: a Tenth Century New Testament Narrative Cycle,Ph.D.,1977,"Bober, Harry",,"Early Christian, Byzantine, and Western Medieval Art",,,
"MANN, Vivian B.",Romanesque Ivory Tablemen,Ph.D.,1977,"Bober, Harry",,"Early Christian, Byzantine, and Western Medieval Art",,,
"SCHWARTZBAUM, Elizabeth",The Romanesque Sculpture of the Cathedral of Tournai,Ph.D.,1977,"Bober, Harry",,"Early Christian, Byzantine, and Western Medieval Art",,,
"PARKER, Elizabeth Crawford",The Descent from the Cross: Its Relation to the Extra-liturgical Depositio Drama,Ph.D.,1975,"Bober, Harry",,"Early Christian, Byzantine, and Western Medieval Art",Renaissance Art,,
"STODDARD, Brooks W.",The Sculpture from the Abbey St.-Pierre at Airvault (Deux-Sevres),Ph.D.,1970,"Bober, Harry",,"Early Christian, Byzantine, and Western Medieval Art",,,
"DYNES, Wayne Robert","The Illumination of the Stavelot Bible (British Museum, Add. Mss. 28106-28107)",Ph.D.,1969,"Bober, Harry",,"Early Christian, Byzantine, and Western Medieval Art",,,
"ALEXANDER, Shirley M.",Problems of metal usage in some late antique and early Christian manuscripts,Ph.D.,1968,"Bober, Harry",,"Early Christian, Byzantine, and Western Medieval Art",,,
"CAHN, Walter",The Souvigny Bible: A Study in Romanesque Manuscript Illumination,Ph.D.,1967,"Bober, Harry",,"Early Christian, Byzantine, and Western Medieval Art",,,
"WERNER, Martin Stanley",The ''Majestas Domini'' and the Eastern Penetration of Hiberno-Saxon Art; a Study of Iconographic Sources,Ph.D.,1967,"Bober, Harry",,"Early Christian, Byzantine, and Western Medieval Art",,,
"RAGUSA, Isa",A Gothic Psalter in Princeton: Garrett MS. 35,Ph.D.,1966,"Bober, Harry",,"Early Christian, Byzantine, and Western Medieval Art",,,
"SANDLER, Lucy Freeman",The Psalter of Robert de Lisle,Ph.D.,1964,"Bober, Harry",,"Early Christian, Byzantine, and Western Medieval Art",,,
"FERBER, Stanley Harold",Crucifixion Iconography in Carolingian Ivory Carvings of the Liuthard and Metz Groups,Ph.D.,1963,"Bober, Harry",,"Early Christian, Byzantine, and Western Medieval Art",,,
"BLOCH, E. Maurice",Bingham: The Artist and his Times,Ph.D.,1957,"Bober, Harry",,Nineteenth- and Twentieth-Century Art,,,
"PAGGI, Maddalena",Four Praenistine Cistas and the Society and Workshops of Praeneste,Ph.D.,2005,"Bonfante, Larissa",,"Ancient Aegean, Egyptian, Greek and Roman Art",,,
"GRANATO, Lois","Ludovico Gonzaga, Barbara of Brandenburg, Andrea Mantegna : the audience room in the castle in Mantua, imagery of virtue, rulership, and destiny",Ph.D.,2008,"Brandt, Kathleen Weil-Garris",,Renaissance Art,,,
"ELET, Yvonne","Papal villeggiatura in early modern Rome: poetry, spoils, and stucco at Raphael's Villa Madama",Ph.D.,2007,"Brandt, Kathleen Weil-Garris",,Renaissance Art,,,
"RAFANELLI, Lisa",The Ambiguity of Touch: Saint Mary Magdalene and the 'Noli Me Tangere' in Early Modern Italy,Ph.D.,2004,"Brandt, Kathleen Weil-Garris",,Renaissance Art,,,
"LA FRANCE, Robert G.","Francesco d'Ubertino Verdi, il Bachiacca (1494-1557): ''diligente dipintore''",Ph.D.,2002,"Brandt, Kathleen Weil-Garris",,Renaissance Art,,,
"WALDMAN, Louis","The Choir of Florence Cathedral : Transformation of Sacred Space, 1334?1572",Ph.D.,1999,"Brandt, Kathleen Weil-Garris",,"Early Christian, Byzantine, and Western Medieval Art",Renaissance Art,,
"CAMBARERI, Marietta",Ippolito Scalza and the 16c Renovation Projects at Orvieto Cathedral,Ph.D.,1998,"Brandt, Kathleen Weil-Garris",,Renaissance Art,,,
"AMY, Michael",Michelangelo's Commission for Apostle Statue for the Cathedral of Florence,Ph.D.,1997,"Brandt, Kathleen Weil-Garris",,Renaissance Art,,,
"KUNTZ, Margaret A.",The Cappella Paolina: Before and After Michelangelo,Ph.D.,1997,"Brandt, Kathleen Weil-Garris",,Renaissance Art,,,
"ROISMAN, Rona",Francesco da Sangallo: The Tombs,Ph.D.,1995,"Brandt, Kathleen Weil-Garris",,Renaissance Art,,,
"JENKENS, A. Lawrence",The Palazzo Piccolomini in Siena: Pius II's Architectural Patronage and its Afterlife,Ph.D.,1994,"Brandt, Kathleen Weil-Garris",,Renaissance Art,,,
"HOLMAN, Beth L.",S. Benedetto Po: Renovation and Reform,Ph.D.,1991,"Brandt, Kathleen Weil-Garris",,Renaissance Art,,,
"NICHOLS, Charlotte F.",The Caracciolo di Vico Chapel in Naples and Early Cinqucento Architecture,Ph.D.,1988,"Brandt, Kathleen Weil-Garris",,Renaissance Art,Architecture,,
"PIERPONT, Claudia Roth",Giovanni da Nola and the Monument of Pedro de Toledo: A Study in Neapolitan Sixteenth Century Sculpture,Ph.D.,1988,"Brandt, Kathleen Weil-Garris",,Renaissance Art,,,
"DARR, Alan Phipps","Pietro Torrigiano and his Sculpture for the Henry VII Chapel, Westminster Abbey",Ph.D.,1980,"Brandt, Kathleen Weil-Garris",,Renaissance Art,,,
"ADAMS, Robert Nicholas",Baldassare Peruzzi: Architect to the Republic of Siena 1527-1535,Ph.D.,1977,"Brandt, Kathleen Weil-Garris",,Renaissance Art,,,
"FINOCCHIO, Ross","Henry Clay Frick: The Making of an American Collector, 1880-1905",Ph.D.,2013,"Jonathan, Brown",,Nineteenth- and Twentieth-Century Art,Collecting; Curatorial and Museum Studies,,
"SCHNEIDER, Lindsey",The Late Career of Pietro da Cortona and Roman Baroque Painting after 1650,Ph.D.,2013,"Jonathan, Brown",,Seventeenth- and Eighteenth-Century Art,,,Conservation of Works of Art and Artifacts
"GARDONIO-FOATE, Casey",Professional Women Artists of Iberia’s Golden Age: Careers in Context,Ph.D.,2012,"Jonathan, Brown",,Seventeenth- and Eighteenth-Century Art,,,
"LEAPER, Laura","Time, Memory and Ritual: deciphering visual rhetoric in Diego Valades’ Rhetorica Christiana",Ph.D.,2012,"Jonathan, Brown",,Seventeenth- and Eighteenth-Century Art,,,
"LEYVA-GUTIERREZ, Niria E.,",Painting Power: Images of Ecclesiastical Authority in Seventeenth-Century New Spain,Ph.D.,2012,"Jonathan, Brown",,Latin American Art,Seventeenth- and Eighteenth-Century Art,,
"BELL, Esther",Charles-Antoine Coypel: Painting and Performance in Eighteenth-Century France,Ph.D.,2011,"Jonathan, Brown",,Seventeenth- and Eighteenth-Century Art,,,
"BROWN, Michael","Portraiture in New Spain, 1600-1800: Painters, Patrons and Politics in Viceregal Mexico",Ph.D.,2011,"Jonathan, Brown",,Latin American Art,Seventeenth- and Eighteenth-Century Art,,
"HUCKINS, Pamela","Art in the Alta California Mission Churches, 1769-1834",Ph.D.,2011,"Jonathan, Brown",,Seventeenth- and Eighteenth-Century Art,,,
"DOLPHIN, Erika",Archbishop Francisco Jimenez de Cisneros and the Decoration of the Chapter Room and Mozarabic Chapel in Toledo Cathedral,Ph.D.,2008,"Jonathan, Brown",,Renaissance Art,,,
"BADIEE-BANTA, Andaleeb",Bernardo Strozzi: Defining an Artistic Identity in Early Seventeenth-Century Genoa,Ph.D.,2007,"Jonathan, Brown",,Seventeenth- and Eighteenth-Century Art,,,
"DUFFY-ZEBALLOS, Lisa",Murillo's Devotional Paintings and the Late Baroque Culture of Prayer in Seville,Ph.D.,2007,"Jonathan, Brown",,Seventeenth- and Eighteenth-Century Art,,,
"McGARRY, Rachel Louise","The Young Guido Reni: The Artist in Bologna and Rome, 1575-1605",Ph.D.,2007,"Jonathan, Brown",,Seventeenth- and Eighteenth-Century Art,,,
"SHEAN, Julie",Models of Virtue: Images and Saint-Making in Colonial Puebla (1640-1800),Ph.D.,2007,"Jonathan, Brown",,Seventeenth- and Eighteenth-Century Art,Latin American Art,,
"BANNER, Lisa",The Religious Patronage of the Duke of Lerma,Ph.D.,2006,"Jonathan, Brown",,Seventeenth- and Eighteenth-Century Art,,,
"PROKOP, Ellen",Fray Juan Andrés Ricci and the Commissions at San Millán de la Cogolla and the Cathedral of Burgos,Ph.D.,2006,"Jonathan, Brown",,Seventeenth- and Eighteenth-Century Art,,,
"SENOS, Nuno",Franciscan Art and Architecture in Colonial Brazil (1650-1800),Ph.D.,2006,"Jonathan, Brown",,Seventeenth- and Eighteenth-Century Art,Latin American Art,,
"SANABRAIS, Sofia",The Biombo or Folding Screen: Examining the Impact of Japan on Artistic Production and the Globalization of Taste in Seventeenth-Century New Spain,Ph.D.,2005,"Jonathan, Brown",,Seventeenth- and Eighteenth-Century Art,East Asian Art,,
"SCHRADER, Jeffrey",The Virgin of Atocha and Spanish Habsburg Devotion to Miraculous Images,Ph.D.,2003,"Jonathan, Brown",,Seventeenth- and Eighteenth-Century Art,,,
"GOODMAN, Eleanor Hope","Royal piety: faith, religious politics, and the experience of art at the Convent of the Descalzas Reales in Madrid",Ph.D.,2001,"Jonathan, Brown",,Seventeenth- and Eighteenth-Century Art,,,
"ROTMIL, Lisa Anne",The Artistic Patronage of Anne of Austria (1601-1666): Image - Making at the French Court,Ph.D.,2000,"Jonathan, Brown",,Seventeenth- and Eighteenth-Century Art,,,
"ALCALA, Luisa Elena","The Jesuits and the visual arts in New Spain, 1670-1767",Ph.D.,1998,"Jonathan, Brown",,Seventeenth- and Eighteenth-Century Art,,,
"VERGARA, W. Alexander",The Presence of Rubens in Spain,Ph.D.,1994,"Jonathan, Brown",,Seventeenth- and Eighteenth-Century Art,,,
"LENAGHAN, Patrick",The Arrival of the Italian Renaissance in Spain: The Tombs by Domenico Fancelli and Bartolomé Ordóñez,Ph.D.,1993,"Jonathan, Brown",,Renaissance Art,,,
"CIOFFI, Irene",Corrado Giaquinto at the Spanish Court 1753-1762: The Fresco Cycles at the New Royal Palace in Madrid,Ph.D.,1992,"Jonathan, Brown",,Seventeenth- and Eighteenth-Century Art,,,
"SCHROTH, Sarah",The Private Picture Collection of the Duke of Lerma,Ph.D.,1990,"Jonathan, Brown",,Seventeenth- and Eighteenth-Century Art,,,
"CARR, Dawson W.",Luca Giordano at the Escorial: The Frescoes for Charles II,Ph.D.,1987,"Jonathan, Brown",,Seventeenth- and Eighteenth-Century Art,,,
"BURKE, Marcus B.",Private Collections of Italian Art in Seventeenth-century Spain,Ph.D.,1984,"Jonathan, Brown",,Seventeenth- and Eighteenth-Century Art,Collecting; Curatorial and Museum Studies,,
"STRATTON, Suzanne",The Immaculate Conception in Spanish Renaissance and Baroque Art,Ph.D.,1983,"Jonathan, Brown",,Seventeenth- and Eighteenth-Century Art,,,
"MANN, Richard G.",El Greco's Altarpieces: Three Representative Commissions,Ph.D.,1982,"Jonathan, Brown",,Seventeenth- and Eighteenth-Century Art,Renaissance Art,,
"JONES, Leslie",The Paintings of Giovanni Battista Piazzetta,Ph.D.,1981,"Jonathan, Brown",,Seventeenth- and Eighteenth-Century Art,,,
"BARGHAHN, Barbara von",The Pictorial Decoration of the Buen Retiro Palace During the Reign of Philip IV,Ph.D.,1979,"Jonathan, Brown",,Seventeenth- and Eighteenth-Century Art,,,
"SULLIVAN, Edward J.",Claudio Coello and Late Baroque Painting in Madrid,Ph.D.,1979,"Jonathan, Brown",,Seventeenth- and Eighteenth-Century Art,,,
"KARL, Adolph Joseph",The New York Realists,Ph.D.,1953,"Milton, Brown",,Nineteenth- and Twentieth-Century Art,,,
"NELSON, Robert S.","Text and Image in a Byzantine Gospel Book in Istanbul (Ecumenical Patriarchate, cod. 3)",Ph.D.,1978,"Buchthal, Hugo",,"Early Christian, Byzantine, and Western Medieval Art",,,
